楷書	かいしょ	漢字の書体の一。点画を正確に書き、現在、最も標準的な書体とされている。隷書から転じたもので、六朝 (りくちょう) 中期に始まり唐のころ完成した。真書。正書。	Regular script. also called 正楷. is the newest of the Chinese script styles (appearing by the Cao Wei dynasty ca. 200 CE and maturing stylistically around the 7th century), hence most common in modern writings and publications (after the Ming and sans-serif styles, used exclusively in print).
楷書体	かいしょたい	漢字の書体の一。点画を正確に書き、現在、最も標準的な書体とされている。隷書から転じたもので、六朝 (りくちょう) 中期に始まり唐のころ完成した。真書。正書。	Regular script. also called 正楷. is the newest of the Chinese script styles (appearing by the Cao Wei dynasty ca. 200 CE and maturing stylistically around the 7th century), hence most common in modern writings and publications (after the Ming and sans-serif styles, used exclusively in print).
行書	ぎょうしょ	漢字の書体の一。楷書をやや崩した書体で、楷書と草書の中間にあたる。	Semi-cursive script is a cursive style of Chinese characters. Because it is not as abbreviated as cursive, most people who can read regular script can read semi-cursive.
行書体	ぎょうしょたい	漢字の書体の一。楷書をやや崩した書体で、楷書と草書の中間にあたる。	Semi-cursive script is a cursive style of Chinese characters. Because it is not as abbreviated as cursive, most people who can read regular script can read semi-cursive.
草書	そうしょ	書体の一。古くは、篆隷 (てんれい) を簡略にしたもの。後代には、行書 (ぎょうしょ) をさらに崩して点画を略し、曲線を多くしたもの。そう。そうがき。	〔字体〕the fully cursive style of writing (Chinese characters); 〔文字〕a character written in 「a cursive hand [the cursive style]
草書体	そうしょたい	書体の一。古くは、篆隷 (てんれい) を簡略にしたもの。後代には、行書 (ぎょうしょ) をさらに崩して点画を略し、曲線を多くしたもの。そう。そうがき。	〔字体〕the fully cursive style of writing (Chinese characters); 〔文字〕a character written in 「a cursive hand [the cursive style]
篆書	てんしょ	中国で秦以前に使われた書体。大篆と小篆とがあり、隷書・楷書のもとになった。印章・碑銘などに使用。篆。	a style of writing Chinese characters (mainly used for seals); a tensho hand. The seal script (often called 'small seal' script) is the formal script of the Qín system of writing, which evolved during the Eastern Zhōu dynasty in the state of Qín and was imposed as the standard in areas Qín gradually conquered. Although some modern calligraphers practice the most ancient oracle bone script as well as various other scripts older than seal script found on Zhōu dynasty bronze inscriptions, seal script is the oldest style that continues to be widely practiced.
隷書	れいしょ	漢字の書体の一。秦の程邈 (ていばく) が小篆 (しょうてん) を簡略化して作ったものといわれる。漢代に装飾的になり、後世、これを八分 (はっぷん) または漢隷、それ以前のものを古隷といって区別した。現在は一般に八分をさす。→八分	Clerical script; also formerly chancery script, is an archaic style of Chinese calligraphy which evolved in the Warring States period to the Qin dynasty, was dominant in the Han dynasty, and remained in use through the Wei-Jin periods.
隷書体	れいしょたい	漢字の書体の一。秦の程邈 (ていばく) が小篆 (しょうてん) を簡略化して作ったものといわれる。漢代に装飾的になり、後世、これを八分 (はっぷん) または漢隷、それ以前のものを古隷といって区別した。現在は一般に八分をさす。→八分	Clerical script; also formerly chancery script, is an archaic style of Chinese calligraphy which evolved in the Warring States period to the Qin dynasty, was dominant in the Han dynasty, and remained in use through the Wei-Jin periods.
